{"$id":"urn:yeisme:schema:background_asset.authoring.v1","$schema":"https://json-schema.org/draft/2020-12/schema","additionalProperties":false,"properties":{"activity_zone":{"minLength":1,"type":"string"},"aspect_ratio":{"minLength":1,"type":"string"},"camera":{"minLength":1,"type":"string"},"lighting":{"minLength":1,"type":"string"},"location_anchor":{"minLength":1,"type":"string"},"profile_id":{"const":"clean-background-plate-v1","type":"string"},"requested_elements":{"items":{"type":"string"},"type":"array"},"subject_count":{"const":0,"type":"integer"},"time_weather":{"minLength":1,"type":"string"},"transparent_required":{"const":false,"type":"boolean"}},"required":["profile_id","location_anchor","camera","time_weather","lighting","aspect_ratio","activity_zone","subject_count"],"title":"AI Drama Background Asset Authoring v1","type":"object"}