{"activity_zone":"画面右下至桥前保留无遮挡活动区","aspect_ratio":"16:9","camera":"河岸平视广角，镜头朝向石桥，弱透视","lighting":"左后方冷色天光，桥下柔和环境光","location_anchor":"古镇石桥与河岸台阶，桥洞和远端牌楼位置固定","profile_id":"clean-background-plate-v1","requested_elements":["empty street","unoccupied boat"],"subject_count":0,"time_weather":"清晨薄雾，无雨","transparent_required":false}